There once lived an old man and an old woman who were peasants and had to work hard to earn their daily bread. The old man used to go to fix fences and do other odd jobs for the farmers around, and while he was gone the old woman, his wife, did the work of the house and worked in their own little plot of land.
It wasn't quite yet time to panic. There was still time to salvage the situation. At least that is what she was telling himself. The reality was that it was time to panic and there wasn't time to salvage the situation, but he continued to delude himself into believing there was.
I'm meant to be writing at this moment. What I mean is, I'm meant to be writing something else at this moment. The document I'm meant to be writing is, of course, open in another program on my computer and is patiently awaiting my attention. Yet here I am plonking down senseless sentiments in this paragraph because it's easier to do than to work on anything particularly meaningful. I am grateful for the distraction.
He couldn't move. His head throbbed and spun. He couldn't decide if it was the flu or the drinking last night. It was probably a combination of both.
He heard the crack echo in the late afternoon about a mile away. His heart started racing and he bolted into a full sprint. "It wasn't a gunshot, it wasn't a gunshot," he repeated under his breathlessness as he continued to sprint.
It was a question of which of the two she preferred. On the one hand, the choice seemed simple. The more expensive one with a brand name would be the choice of most. It was the easy choice. The safe choice. But she wasn't sure she actually preferred it.
Josh had spent year and year accumulating the information. He knew it inside out and if there was ever anyone looking for an expert in the field, Josh would be the one to call. The problem was that there was nobody interested in the information besides him and he knew it. Years of information painstakingly memorized and sorted with not a sole giving even an ounce of interest in the topic.
She didn't like the food. She never did. She made the usual complaints and started the tantrum he knew was coming. But this time was different. Instead of trying to placate her and her unreasonable demands, he just stared at her and watched her meltdown without saying a word.
His parents continued to question him. He didn't know what to say to them since they refused to believe the truth. He explained again and again, and they dismissed his explanation as a figment of his imagination. There was no way that grandpa, who had been dead for five years, could have told him where the treasure had been hidden. Of course, it didn't help that grandpa was roaring with laughter in the chair next to him as he tried to explain once again how he'd found it.
There was something beautiful in his hate. It wasn't the hate itself as it was a disgusting display of racism and intolerance. It was what propelled the hate and the fact that although he had this hate, he didn't understand where it came from. It was at that moment that she realized that there was hope in changing him.
He had three simple rules by which he lived. The first was to never eat blue food. There was nothing in nature that was edible that was blue. People often asked about blueberries, but everyone knows those are actually purple. He understood it was one of the stranger rules to live by, but it had served him well thus far in the 50+ years of his life.
I recently discovered I could make fudge with just chocolate chips, sweetened condensed milk, vanilla extract, and a thick pot on slow heat. I tried it with dark chocolate chunks and I tried it with semi-sweet chocolate chips. It's better with both kinds. It comes out pretty bad with just the dark chocolate. The best add-ins are crushed almonds and marshmallows -- what you get from that is Rocky Road. It takes about twenty minutes from start to fridge, and then it takes about six months to work off the twenty pounds you gain from eating it. All things in moderation, friends. All things in moderation.
He heard the loud impact before he ever saw the result. It had been so loud that it had actually made him jump back in his seat. As soon as he recovered from the surprise, he saw the crack in the windshield. It seemed to be an analogy of the current condition of his life.
Dave wasn't exactly sure how he had ended up in this predicament. He ran through all the events that had lead to this current situation and it still didn't make sense. He wanted to spend some time to try and make sense of it all, but he had higher priorities at the moment. The first was how to get out of his current situation of being naked in a tree with snow falling all around and no way for him to get down.
Sleeping in his car was never the plan but sometimes things don't work out as planned. This had been his life for the last three months and he was just beginning to get used to it. He didn't actually enjoy it, but he had accepted it and come to terms with it. Or at least he thought he had. All that changed when he put the key into the ignition, turned it and the engine didn't make a sound.
He was aware there were numerous wonders of this world including the unexplained creations of humankind that showed the wonder of our ingenuity. There are huge heads on Easter Island. There are the Egyptian pyramids. There’s Stonehenge. But he now stood in front of a newly discovered monument that simply didn't make any sense and he wondered how he was ever going to be able to explain it.
It was just a burger. Why couldn't she understand that? She knew he'd completely changed his life around her eating habits, so why couldn't she give him a break this one time? She wasn't even supposed to have found out. Yes, he had promised her and yes, he had broken that promise, but still in his mind, all it had been was just a burger.
The alarm went off and Jake rose awake. Rising early had become a daily ritual, one that he could not fully explain. From the outside, it was a wonder that he was able to get up so early each morning for someone who had absolutely no plans to be productive during the entire day.
Turning away from the ledge, he started slowly down the mountain, deciding that he would, that very night, satisfy his curiosity about the man-house. In the meantime, he would go down into the canyon and get a cool drink, after which he would visit some berry patches just over the ridge, and explore among the foothills a bit before his nap-time, which always came just after the sun had walked past the middle of the sky. At that period of the day the sun’s warm rays seemed to cast a sleepy spell over the silent mountainside, so all of the animals, with one accord, had decided it should be the hour for their mid-day sleep.
It was a scrape that he hardly noticed. Sure, there was a bit of blood but it was minor compared to most of the other cuts and bruises he acquired on his adventures. There was no way he could know that the rock that produced the cut had alien genetic material on it that was now racing through his bloodstream. He felt perfectly normal and continued his adventure with no knowledge of what was about to happen to him.
Indescribable oppression, which seemed to generate in some unfamiliar part of her consciousness, filled her whole being with a vague anguish. It was like a shadow, like a mist passing across her soul's summer day. It was strange and unfamiliar; it was a mood. She did not sit there inwardly upbraiding her husband, lamenting at Fate, which had directed her footsteps to the path which they had taken. She was just having a good cry all to herself. The mosquitoes made merry over her, biting her firm, round arms and nipping at her bare insteps.
She looked at her little girl who was about to become a teen. She tried to think back to when the girl had been younger but failed to pinpoint the exact moment when she had become a little too big to pick up and carry. It hit her all at once. She was no longer a little girl and she stood there speechless with fear, sadness, and pride all running through her at the same time.
Where do they get a random paragraph?" he wondered as he clicked the generate button. Do they just write a random paragraph or do they get it somewhere? At that moment he read the random paragraph and realized it was about random paragraphs and his world would never be the same.
It was their first date and she had been looking forward to it the entire week. She had her eyes on him for months, and it had taken a convoluted scheme with several friends to make it happen, but he'd finally taken the hint and asked her out. After all the time and effort she'd invested into it, she never thought that it would be anything but wonderful. It goes without saying that things didn't work out quite as she expected.
Waiting and watching. It was all she had done for the past weeks. When you’re locked in a room with nothing but food and drink, that’s about all you can do anyway. She watched as birds flew past the window bolted shut. She couldn’t reach it if she wanted too, with that hole in the floor. She thought she could escape through it but three stories is a bit far down.
It had become a far too common an event in her life. She has specifically placed the key to the box in a special place so that she wouldn't lose it and know exactly where it was when the key was needed. Now that she needed to open the box, she had absolutely no idea where that special spot she placed the key might be.
As she sat watching the world go by, something caught her eye. It wasn't so much its color or shape, but the way it was moving. She squinted to see if she could better understand what it was and where it was going, but it didn't help. As she continued to stare into the distance, she didn't understand why this uneasiness was building inside her body. She felt like she should get up and run. If only she could make out what it was. At that moment, she comprehended what it was and where it was heading, and she knew her life would never be the same.
Sometimes it's simply better to ignore the haters. That's the lesson that Tom's dad had been trying to teach him, but Tom still couldn't let it go. He latched onto them and their hate and couldn't let it go, but he also realized that this wasn't healthy. That's when he came up with his devious plan.
She looked at her student wondering if she could ever get through. "You need to learn to think for yourself," she wanted to tell him. "Your friends are holding you back and bringing you down." But she didn't because she knew his friends were all that he had and even if that meant a life of misery, he would never give them up.
He picked up the burnt end of the branch and made a mark on the stone. Day 52 if the marks on the stone were accurate. He couldn't be sure. Day and nights had begun to blend together creating confusion, but he knew it was a long time. Much too long.
All he could think about was how it would all end. There was still a bit of uncertainty in the equation, but the basics were there for anyone to see. No matter how much he tried to see the positive, it wasn't anywhere to be seen. The end was coming and it wasn't going to be pretty.
She had been an angel for coming up on 10 years and in all that time nobody had told her this was possible. The fact that it could ever happen never even entered her mind. Yet there she stood, with the undeniable evidence sitting on the ground before her. Angels could lose their wings.
Was it enough? That was the question he kept asking himself. Was being satisfied enough? He looked around him at everyone yearning to just be satisfied in their daily life and he had reached that goal. He knew that he was satisfied and he also knew it wasn't going to be enough.
They argue. While the argument seems to be different the truth is it's always the same. Yes, the topic may be different or the circumstances, but when all said and done, it all came back to the same thing. They both knew it, but neither has the courage or strength to address the underlying issue. So they continue to argue.
It seemed like it should have been so simple. There was nothing inherently difficult with getting the project done. It was simple and straightforward enough that even a child should have been able to complete it on time, but that wasn't the case. The deadline had arrived and the project remained unfinished.
Greg understood that this situation would make Michael terribly uncomfortable. Michael simply had no idea what was about to come and even though Greg could prevent it from happening, he opted to let it happen. It was quite ironic, really. It was something Greg had said he would never wish upon anyone a million times, yet here he was knowingly letting it happen to one of his best friends. He rationalized that it would ultimately make Michael a better person and that no matter how uncomfortable, everyone should experience racism at least once in their lifetime.
You can decide what you want to do in life, but I suggest doing something that creates. Something that leaves a tangible thing once you're done. That way even after you're gone, you will still live on in the things you created.
There was little doubt that the bridge was unsafe. All one had to do was look at it to know that with certainty. Yet Bob didn't see another option. He may have been able to work one out if he had a bit of time to think things through, but time was something he didn't have. A choice needed to be made, and it needed to be made quickly.
Hopes and dreams were dashed that day. It should have been expected, but it still came as a shock. The warning signs had been ignored in favor of the possibility, however remote, that it could actually happen. That possibility had grown from hope to an undeniable belief it must be destiny. That was until it wasn't and the hopes and dreams came crashing down.
She didn't understand how changed worked. When she looked at today compared to yesterday, there was nothing that she could see that was different. Yet, when she looked at today compared to last year, she couldn't see how anything was ever the same.
The chair sat in the corner where it had been for over 25 years. The only difference was there was someone actually sitting in it. How long had it been since someone had done that? Ten years or more he imagined. Yet there was no denying the presence in the chair now.
He was an expert but not in a discipline that anyone could fully appreciate. He knew how to hold the cone just right so that the soft server ice-cream fell into it at the precise angle to form a perfect cone each and every time. It had taken years to perfect and he could now do it without even putting any thought behind it. Nobody seemed to fully understand the beauty of this accomplishment except for the new worker who watched in amazement.
It was a concerning development that he couldn't get out of his mind. He'd had many friends throughout his early years and had fond memories of playing with them, but he couldn't understand how it had all stopped. There was some point as he grew up that he played with each of his friends for the very last time, and he had no idea that it would be the last.
The wolves stopped in their tracks, sizing up the mother and her cubs. It had been over a week since their last meal and they were getting desperate. The cubs would make a good meal, but there were high risks taking on the mother Grizzly. A decision had to be made and the wrong choice could signal the end of the pack.
It had been her dream for years but Dana had failed to take any action toward making it come true. There had always been a good excuse to delay or prioritize another project. As she woke, she realized she was once again at a crossroads. Would it be another excuse or would she finally find the courage to pursue her dream? Dana rose and took her first step.
I'm heading back to Colorado tomorrow after being down in Santa Barbara over the weekend for the festival there. I will be making October plans once there and will try to arrange so I'm back here for the birthday if possible. I'll let you know as soon as I know the doctor's appointment schedule and my flight plans.
It went through such rapid contortions that the little bear was forced to change his hold on it so many times he became confused in the darkness, and could not, for the life of him, tell whether he held the sheep right side up, or upside down. But that point was decided for him a moment later by the animal itself, who, with a sudden twist, jabbed its horns so hard into his lowest ribs that he gave a grunt of anger and disgust.
It was difficult to explain to them how the diagnosis of certain death had actually given him life. While everyone around him was in tears and upset, he actually felt more at ease. The doctor said it would be less than a year. That gave him a year to live, something he'd failed to do with his daily drudgery of a routine that had passed as life until then.
Dave watched as the forest burned up on the hill, only a few miles from her house. The car had been hastily packed and Marta was inside trying to round up the last of the pets. Dave went through his mental list of the most important papers and documents that they couldn't leave behind. He scolded himself for not having prepared these better in advance and hoped that he had remembered everything that was needed. He continued to wait for Marta to appear with the pets, but she still was nowhere to be seen.
I recollect that my first exploit in squirrel-shooting was in a grove of tall walnut-trees that shades one side of the valley. I had wandered into it at noontime, when all nature is peculiarly quiet, and was startled by the roar of my own gun, as it broke the Sabbath stillness around and was prolonged and reverberated by the angry echoes.
The red glint of paint sparkled under the sun. He had dreamed of owning this car since he was ten, and that dream had become a reality less than a year ago. It was his baby and he spent hours caring for it, pampering it, and fondling over it. She knew this all too well, and that's exactly why she had taken a sludge hammer to it.
It wasn't quite yet time to panic. There was still time to salvage the situation. At least that is what she was telling himself. The reality was that it was time to panic and there wasn't time to salvage the situation, but he continued to delude himself into believing there was.
She had come to the conclusion that you could tell a lot about a person by their ears. The way they stuck out and the size of the earlobes could give you wonderful insights into the person. Of course, she couldn't scientifically prove any of this, but that didn't matter to her. Before anything else, she would size up the ears of the person she was talking to.
He sat across from her trying to imagine it was the first time. It wasn't. Had it been a hundred? It quite possibly could have been. Two hundred? Probably not. His mind wandered until he caught himself and again tried to imagine it was the first time.
He couldn't move. His head throbbed and spun. He couldn't decide if it was the flu or the drinking last night. It was probably a combination of both.
It was just a burger. Why couldn't she understand that? She knew he'd completely changed his life around her eating habits, so why couldn't she give him a break this one time? She wasn't even supposed to have found out. Yes, he had promised her and yes, he had broken that promise, but still in his mind, all it had been was just a burger.
She tried not to judge him. His ratty clothes and unkempt hair made him look homeless. Was he really the next Einstein as she had been told? On the off chance it was true, she continued to try not to judge him.
I've rented a car in Las Vegas and have reserved a hotel in Twentynine Palms which is just north of Joshua Tree. We'll drive from Las Vegas through Mojave National Preserve and possibly do a short hike on our way down. Then spend all day on Monday at Joshua Tree. We can decide the next morning if we want to do more in Joshua Tree or Mojave before we head back.
She patiently waited for his number to be called. She had no desire to be there, but her mom had insisted that she go. She's resisted at first, but over time she realized it was simply easier to appease her and go. Mom tended to be that way. She would keep insisting until you wore down and did what she wanted. So, here she sat, patiently waiting for her number to be called.
What have you noticed today? I noticed that if you outline the eyes, nose, and mouth on your face with your finger, you make an "I" which makes perfect sense, but is something I never noticed before. What have you noticed today?
Then came the night of the first falling star. It was seen early in the morning, rushing over Winchester eastward, a line of flame high in the atmosphere. Hundreds must have seen it and taken it for an ordinary falling star. It seemed that it fell to earth about one hundred miles east of him.
Waiting and watching. It was all she had done for the past weeks. When you’re locked in a room with nothing but food and drink, that’s about all you can do anyway. She watched as birds flew past the window bolted shut. She couldn’t reach it if she wanted too, with that hole in the floor. She thought she could escape through it but three stories is a bit far down.
