"It was so great to hear from you today and it was such weird timing," he said. "This is going to sound funny and a little strange, but you were in a dream I had just a couple of days ago. I'd love to get together and tell you about it if you're up for a cup of coffee," he continued, laying the trap he'd been planning for years.
She tried to explain that love wasn't like pie. There wasn't a set number of slices to be given out. There wasn't less to be given to one person if you wanted to give more to another. That after a set amount was given out it would all disappear. She tried to explain this, but it fell on deaf ears.
His parents continued to question him. He didn't know what to say to them since they refused to believe the truth. He explained again and again, and they dismissed his explanation as a figment of his imagination. There was no way that grandpa, who had been dead for five years, could have told him where the treasure had been hidden. Of course, it didn't help that grandpa was roaring with laughter in the chair next to him as he tried to explain once again how he'd found it.
He sat staring at the person in the train stopped at the station going in the opposite direction. She sat staring ahead, never noticing that she was being watched. Both trains began to move and he knew that in another timeline or in another universe, they had been happy together.
I recently discovered I could make fudge with just chocolate chips, sweetened condensed milk, vanilla extract, and a thick pot on slow heat. I tried it with dark chocolate chunks and I tried it with semi-sweet chocolate chips. It's better with both kinds. It comes out pretty bad with just the dark chocolate. The best add-ins are crushed almonds and marshmallows -- what you get from that is Rocky Road. It takes about twenty minutes from start to fridge, and then it takes about six months to work off the twenty pounds you gain from eating it. All things in moderation, friends. All things in moderation.
Barbara had been waiting at the table for twenty minutes. it had been twenty long and excruciating minutes. David had promised that he would be on time today. He never was, but he had promised this one time. She had made him repeat the promise multiple times over the last week until she'd believed his promise. Now she was paying the price.
You can decide what you want to do in life, but I suggest doing something that creates. Something that leaves a tangible thing once you're done. That way even after you're gone, you will still live on in the things you created.
There was little doubt that the bridge was unsafe. All one had to do was look at it to know that with certainty. Yet Bob didn't see another option. He may have been able to work one out if he had a bit of time to think things through, but time was something he didn't have. A choice needed to be made, and it needed to be made quickly.
She wanted rainbow hair. That's what she told the hairdresser. It should be deep rainbow colors, too. She wasn't interested in pastel rainbow hair. She wanted it deep and vibrant so there was no doubt that she had done this on purpose.
The leather jacked showed the scars of being his favorite for years. It wore those scars with pride, feeling that they enhanced his presence rather than diminishing it. The scars gave it character and had not overwhelmed to the point that it had become ratty. The jacket was in its prime and it knew it.
There were little things that she simply could not stand. The sound of someone tapping their nails on the table. A person chewing with their mouth open. Another human imposing themselves into her space. She couldn't stand any of these things, but none of them compared to the number one thing she couldn't stand which topped all of them combined.
Her mom had warned her. She had been warned time and again, but she had refused to believe her. She had done everything right and she knew she would be rewarded for doing so with the promotion. So when the promotion was given to her main rival, it not only stung, it threw her belief system into disarray. It was her first big lesson in life, but not the last.
He took a sip of the drink. He wasn't sure whether he liked it or not, but at this moment it didn't matter. She had made it especially for him so he would have forced it down even if he had absolutely hated it. That's simply the way things worked. She made him a new-fangled drink each day and he took a sip of it and smiled, saying it was excellent.
Her eyebrows were a shade darker than her hair. They were thick and almost horizontal, emphasizing the depth of her eyes. She was rather handsome than beautiful. Her face was captivating by reason of a certain frankness of expression and a contradictory subtle play of features. Her manner was engaging.
She considered the birds to be her friends. She'd put out food for them each morning and then she'd watch as they came to the feeders to gorge themselves for the day. She wondered what they would do if something ever happened to her. Would they miss the meals she provided if she failed to put out the food one morning?
He watched as the young man tried to impress everyone in the room with his intelligence. There was no doubt that he was smart. The fact that he was more intelligent than anyone else in the room could have been easily deduced, but nobody was really paying any attention due to the fact that it was also obvious that the young man only cared about his intelligence.
Don't forget that gifts often come with costs that go beyond their purchase price. When you purchase a child the latest smartphone, you're also committing to a monthly phone bill. When you purchase the latest gaming system, you're likely not going to be satisfied with the games that come with it for long and want to purchase new titles to play. When you buy gifts it's important to remember that some come with additional costs down the road that can be much more expensive than the initial gift itself.
Eating raw fish didn't sound like a good idea. "It's a delicacy in Japan," didn't seem to make it any more appetizing. Raw fish is raw fish, delicacy or not.
Turning away from the ledge, he started slowly down the mountain, deciding that he would, that very night, satisfy his curiosity about the man-house. In the meantime, he would go down into the canyon and get a cool drink, after which he would visit some berry patches just over the ridge, and explore among the foothills a bit before his nap-time, which always came just after the sun had walked past the middle of the sky. At that period of the day the sun’s warm rays seemed to cast a sleepy spell over the silent mountainside, so all of the animals, with one accord, had decided it should be the hour for their mid-day sleep.
The words hadn't flowed from his fingers for the past few weeks. He never imagined he'd find himself with writer's block, but here he sat with a blank screen in front of him. That blank screen taunting him day after day had started to play with his mind. He didn't understand why he couldn't even type a single word, just one to begin the process and build from there. And yet, he already knew that the eight hours he was prepared to sit in front of his computer today would end with the screen remaining blank.
He was an expert but not in a discipline that anyone could fully appreciate. He knew how to hold the cone just right so that the soft server ice-cream fell into it at the precise angle to form a perfect cone each and every time. It had taken years to perfect and he could now do it without even putting any thought behind it. Nobody seemed to fully understand the beauty of this accomplishment except for the new worker who watched in amazement.
There are only three ways to make this work. The first is to let me take care of everything. The second is for you to take care of everything. The third is to split everything 50 / 50. I think the last option is the most preferable, but I'm certain it'll also mean the end of our marriage.
I'm going to hire professional help tomorrow. I can't handle this anymore. She fell over the coffee table and now there is blood in her catheter. This is much more than I ever signed up to do.
According to the caption on the bronze marker placed by the Multnomah Chapter of the Daughters of the American Revolution on May 12, 1939, “College Hall (is) the oldest building in continuous use for Educational purposes west of the Rocky Mountains. Here were educated men and women who have won recognition throughout the world in all the learned professions.”
Balloons are pretty and come in different colors, different shapes, different sizes, and they can even adjust sizes as needed. But don't make them too big or they might just pop, and then bye-bye balloon. It'll be gone and lost for the rest of mankind. They can serve a variety of purposes, from decorating to water balloon wars. You just have to use your head to think a little bit about what to do with them.
She sat in the darkened room waiting. It was now a standoff. He had the power to put her in the room, but not the power to make her repent. It wasn't fair and no matter how long she had to endure the darkness, she wouldn't change her attitude. At three years old, Sandy's stubborn personality had already bloomed into full view.
It had been her dream for years but Dana had failed to take any action toward making it come true. There had always been a good excuse to delay or prioritize another project. As she woke, she realized she was once again at a crossroads. Would it be another excuse or would she finally find the courage to pursue her dream? Dana rose and took her first step.
She had been an angel for coming up on 10 years and in all that time nobody had told her this was possible. The fact that it could ever happen never even entered her mind. Yet there she stood, with the undeniable evidence sitting on the ground before her. Angels could lose their wings.
Sometimes it's the first moment of the day that catches you off guard. That's what Wendy was thinking. She opened her window to see fire engines screeching down the street. While this wasn't something completely unheard of, it also wasn't normal. It was a sure sign of what was going to happen that day. She could feel it in her bones and it wasn't the way she wanted the day to begin.
The trees, therefore, must be such old and primitive techniques that they thought nothing of them, deeming them so inconsequential that even savages like us would know of them and not be suspicious. At that, they probably didn't have too much time after they detected us orbiting and intending to land. And if that were true, there could be only one place where their civilization was hidden.
He heard the crack echo in the late afternoon about a mile away. His heart started racing and he bolted into a full sprint. "It wasn't a gunshot, it wasn't a gunshot," he repeated under his breathlessness as he continued to sprint.
This is important to remember. Love isn't like pie. You don't need to divide it among all your friends and loved ones. No matter how much love you give, you can always give more. It doesn't run out, so don't try to hold back giving it as if it may one day run out. Give it freely and as much as you want.
There was a time when he would have embraced the change that was coming. In his youth, he sought adventure and the unknown, but that had been years ago. He wished he could go back and learn to find the excitement that came with change but it was useless. That curiosity had long left him to where he had come to loathe anything that put him out of his comfort zone.
It was difficult to explain to them how the diagnosis of certain death had actually given him life. While everyone around him was in tears and upset, he actually felt more at ease. The doctor said it would be less than a year. That gave him a year to live, something he'd failed to do with his daily drudgery of a routine that had passed as life until then.
There was no time. He ran out of the door without half the stuff he needed for work, but it didn't matter. He was late and if he didn't make this meeting on time, someone's life may be in danger.
There was something beautiful in his hate. It wasn't the hate itself as it was a disgusting display of racism and intolerance. It was what propelled the hate and the fact that although he had this hate, he didn't understand where it came from. It was at that moment that she realized that there was hope in changing him.
Cake or pie? I can tell a lot about you by which one you pick. It may seem silly, but cake people and pie people are really different. I know which one I hope you are, but that's not for me to decide. So, what is it? Cake or pie?
It went through such rapid contortions that the little bear was forced to change his hold on it so many times he became confused in the darkness, and could not, for the life of him, tell whether he held the sheep right side up, or upside down. But that point was decided for him a moment later by the animal itself, who, with a sudden twist, jabbed its horns so hard into his lowest ribs that he gave a grunt of anger and disgust.
The robot clicked disapprovingly, gurgled briefly inside its cubical interior and extruded a pony glass of brownish liquid. "Sir, you will undoubtedly end up in a drunkard's grave, dead of hepatic cirrhosis," it informed me virtuously as it returned my ID card. I glared as I pushed the glass across the table.
She tried to explain that love wasn't like pie. There wasn't a set number of slices to be given out. There wasn't less to be given to one person if you wanted to give more to another. That after a set amount was given out it would all disappear. She tried to explain this, but it fell on deaf ears.
It was a weird concept. Why would I really need to generate a random paragraph? Could I actually learn something from doing so? All these questions were running through her head as she pressed the generate button. To her surprise, she found what she least expected to see.
It's always good to bring a slower friend with you on a hike. If you happen to come across bears, the whole group doesn't have to worry. Only the slowest in the group do. That was the lesson they were about to learn that day.
There was something beautiful in his hate. It wasn't the hate itself as it was a disgusting display of racism and intolerance. It was what propelled the hate and the fact that although he had this hate, he didn't understand where it came from. It was at that moment that she realized that there was hope in changing him.
"What is the best way to get what you want?" she asked. He looked down at the ground knowing that she wouldn't like his answer. He hesitated, knowing that the truth would only hurt. How was he going to tell her that the best way for him to get what he wanted was to leave her?
Cake or pie? I can tell a lot about you by which one you pick. It may seem silly, but cake people and pie people are really different. I know which one I hope you are, but that's not for me to decide. So, what is it? Cake or pie?
Don't be scared. The things out there that are unknown aren't scary in themselves. They are just unknown at the moment. Take the time to know them before you list them as scary. Then the world will be a much less scary place for you.
She tried not to judge him. His ratty clothes and unkempt hair made him look homeless. Was he really the next Einstein as she had been told? On the off chance it was true, she continued to try not to judge him.
She asked the question even though she didn't really want to hear the answer. It was a no-win situation since she already knew. If he told the truth, she'd get confirmation of her worst fears. If he lied, she'd know that he wasn't who she thought he was which would be almost as bad. Yet she asked the question anyway and waited for his answer.
He took a sip of the drink. He wasn't sure whether he liked it or not, but at this moment it didn't matter. She had made it especially for him so he would have forced it down even if he had absolutely hated it. That's simply the way things worked. She made him a new-fangled drink each day and he took a sip of it and smiled, saying it was excellent.
If you can imagine a furry humanoid seven feet tall, with the face of an intelligent gorilla and the braincase of a man, you'll have a rough idea of what they looked like -- except for their teeth. The canines would have fitted better in the face of a tiger, and showed at the corners of their wide, thin-lipped mouths, giving them an expression of ferocity.
She counted. One. She could hear the steps coming closer. Two. Puffs of breath could be seen coming from his mouth. Three. He stopped beside her. Four. She pulled the trigger of the gun.
It was difficult for him to admit he was wrong. He had been so certain that he was correct and the deeply held belief could never be shaken. Yet the proof that he had been incorrect stood right before his eyes. "See daddy, I told you that they are real!" his daughter excitedly proclaimed.
Many people say that life isn't like a bed of roses. I beg to differ. I think that life is quite like a bed of roses. Just like life, a bed of roses looks pretty on the outside, but when you're in it, you find that it is nothing but thorns and pain. I myself have been pricked quite badly.
Sometimes there isn't a good answer. No matter how you try to rationalize the outcome, it doesn't make sense. And instead of an answer, you are simply left with a question. Why?
The cab arrived late. The inside was in as bad of shape as the outside which was concerning, and it didn't appear that it had been cleaned in months. The green tree air-freshener hanging from the rearview mirror was either exhausted of its scent or not strong enough to overcome the other odors emitting from the cab. The correct decision, in this case, was to get the hell out of it and to call another cab, but she was late and didn't have a choice.
Greg understood that this situation would make Michael terribly uncomfortable. Michael simply had no idea what was about to come and even though Greg could prevent it from happening, he opted to let it happen. It was quite ironic, really. It was something Greg had said he would never wish upon anyone a million times, yet here he was knowingly letting it happen to one of his best friends. He rationalized that it would ultimately make Michael a better person and that no matter how uncomfortable, everyone should experience racism at least once in their lifetime.
The trees, therefore, must be such old and primitive techniques that they thought nothing of them, deeming them so inconsequential that even savages like us would know of them and not be suspicious. At that, they probably didn't have too much time after they detected us orbiting and intending to land. And if that were true, there could be only one place where their civilization was hidden.
Out of another, I get a lovely view of the bay and a little private wharf belonging to the estate. There is a beautiful shaded lane that runs down there from the house. I always fancy I see people walking in these numerous paths and arbors, but John has cautioned me not to give way to fancy in the least. He says that with my imaginative power and habit of story-making a nervous weakness like mine is sure to lead to all manner of excited fancies and that I ought to use my will and good sense to check the tendency. So I try.
"Begin today!" That's all the note said. There was no indication from where it came or who may have written it. Had it been meant for someone else? Meghan looked around the room, but nobody made eye contact back. For a brief moment, she thought it might be a message for her to follow her dreams, but ultimately decided it was easier to ignore it as she crumpled it up and threw it away.
I recently discovered I could make fudge with just chocolate chips, sweetened condensed milk, vanilla extract, and a thick pot on slow heat. I tried it with dark chocolate chunks and I tried it with semi-sweet chocolate chips. It's better with both kinds. It comes out pretty bad with just the dark chocolate. The best add-ins are crushed almonds and marshmallows -- what you get from that is Rocky Road. It takes about twenty minutes from start to fridge, and then it takes about six months to work off the twenty pounds you gain from eating it. All things in moderation, friends. All things in moderation.
He looked at the sand. Picking up a handful, he wondered how many grains were in his hand. Hundreds of thousands? "Not enough," the said under his breath. I need more.
There was no time. He ran out of the door without half the stuff he needed for work, but it didn't matter. He was late and if he didn't make this meeting on time, someone's life may be in danger.
Dave wasn't exactly sure how he had ended up in this predicament. He ran through all the events that had lead to this current situation and it still didn't make sense. He wanted to spend some time to try and make sense of it all, but he had higher priorities at the moment. The first was how to get out of his current situation of being naked in a tree with snow falling all around and no way for him to get down.
"Explain to me again why I shouldn't cheat?" he asked. "All the others do and nobody ever gets punished for doing so. I should go about being happy losing to cheaters because I know that I don't? That's what you're telling me?"
Sometimes that's just the way it has to be. Sure, there were probably other options, but he didn't let them enter his mind. It was done and that was that. It was just the way it had to be.
It had been her dream for years but Dana had failed to take any action toward making it come true. There had always been a good excuse to delay or prioritize another project. As she woke, she realized she was once again at a crossroads. Would it be another excuse or would she finally find the courage to pursue her dream? Dana rose and took her first step.
She was in a hurry. Not the standard hurry when you're in a rush to get someplace, but a frantic hurry. The type of hurry where a few seconds could mean life or death. She raced down the road ignoring speed limits and weaving between cars. She was only a few minutes away when traffic came to a dead standstill on the road ahead.
He heard the loud impact before he ever saw the result. It had been so loud that it had actually made him jump back in his seat. As soon as he recovered from the surprise, he saw the crack in the windshield. It seemed to be an analogy of the current condition of his life.
Dave found joy in the daily routine of life. He awoke at the same time, ate the same breakfast and drove the same commute. He worked at a job that never seemed to change and he got home at 6 pm sharp every night. It was who he had been for the last ten years and he had no idea that was all about to change.
Turning away from the ledge, he started slowly down the mountain, deciding that he would, that very night, satisfy his curiosity about the man-house. In the meantime, he would go down into the canyon and get a cool drink, after which he would visit some berry patches just over the ridge, and explore among the foothills a bit before his nap-time, which always came just after the sun had walked past the middle of the sky. At that period of the day the sun’s warm rays seemed to cast a sleepy spell over the silent mountainside, so all of the animals, with one accord, had decided it should be the hour for their mid-day sleep.
It had become a far too common an event in her life. She has specifically placed the key to the box in a special place so that she wouldn't lose it and know exactly where it was when the key was needed. Now that she needed to open the box, she had absolutely no idea where that special spot she placed the key might be.
You can decide what you want to do in life, but I suggest doing something that creates. Something that leaves a tangible thing once you're done. That way even after you're gone, you will still live on in the things you created.
