Eating raw fish didn't sound like a good idea. "It's a delicacy in Japan," didn't seem to make it any more appetizing. Raw fish is raw fish, delicacy or not.
The shoes had been there for as long as anyone could remember. In fact, it was difficult for anyone to come up with a date they had first appeared. It had seemed they'd always been there and yet they seemed so out of place. Why nobody had removed them was a question that had been asked time and again, but while they all thought it, nobody had ever found the energy to actually do it. So, the shoes remained on the steps, out of place in one sense, but perfectly normal in another.
It was going to rain. The weather forecast didn't say that, but the steel plate in his hip did. He had learned over the years to trust his hip over the weatherman. It was going to rain, so he better get outside and prepare.
She looked at her little girl who was about to become a teen. She tried to think back to when the girl had been younger but failed to pinpoint the exact moment when she had become a little too big to pick up and carry. It hit her all at once. She was no longer a little girl and she stood there speechless with fear, sadness, and pride all running through her at the same time.
Spending time at national parks can be an exciting adventure, but this wasn't the type of excitement she was hoping to experience. As she contemplated the situation she found herself in, she knew she'd gotten herself in a little more than she bargained for. It wasn't often that she found herself in a tree staring down at a pack of wolves that were looking to make her their next meal.
They rushed out the door, grabbing anything and everything they could think of they might need. There was no time to double-check to make sure they weren't leaving something important behind. Everything was thrown into the car and they sped off. Thirty minutes later they were safe and that was when it dawned on them that they had forgotten the most important thing of all.
There was little doubt that the bridge was unsafe. All one had to do was look at it to know that with certainty. Yet Bob didn't see another option. He may have been able to work one out if he had a bit of time to think things through, but time was something he didn't have. A choice needed to be made, and it needed to be made quickly.
The computer wouldn't start. She banged on the side and tried again. Nothing. She lifted it up and dropped it to the table. Still nothing. She banged her closed fist against the top. It was at this moment she saw the irony of trying to fix the machine with violence.
You know that tingly feeling you get on the back of your neck sometimes? I just got that feeling when talking with her. You know I don't believe in sixth senses, but there is something not right with her. I don't know how I know, but I just do.
Sleeping in his car was never the plan but sometimes things don't work out as planned. This had been his life for the last three months and he was just beginning to get used to it. He didn't actually enjoy it, but he had accepted it and come to terms with it. Or at least he thought he had. All that changed when he put the key into the ignition, turned it and the engine didn't make a sound.
It's not his fault. I know you're going to want to, but you can't blame him. He really has no idea how it happened. I kept trying to come up with excuses I could say to mom that would keep her calm when she found out what happened, but the more I tried, the more I could see none of them would work. He was going to get her wrath and there was nothing I could say to prevent it.
I guess we could discuss the implications of the phrase "meant to be." That is if we wanted to drown ourselves in a sea of backwardly referential semantics and other mumbo-jumbo. Maybe such a discussion would result in the determination that "meant to be" is exactly as meaningless a phrase as it seems to be, and that none of us is actually meant to be doing anything at all. But that's my existential underpants underpinnings showing. It's the way the cookie crumbles. And now I want a cookie.
He was an expert but not in a discipline that anyone could fully appreciate. He knew how to hold the cone just right so that the soft server ice-cream fell into it at the precise angle to form a perfect cone each and every time. It had taken years to perfect and he could now do it without even putting any thought behind it. Nobody seemed to fully understand the beauty of this accomplishment except for the new worker who watched in amazement.
The words hadn't flowed from his fingers for the past few weeks. He never imagined he'd find himself with writer's block, but here he sat with a blank screen in front of him. That blank screen taunting him day after day had started to play with his mind. He didn't understand why he couldn't even type a single word, just one to begin the process and build from there. And yet, he already knew that the eight hours he was prepared to sit in front of his computer today would end with the screen remaining blank.
The leather jacked showed the scars of being his favorite for years. It wore those scars with pride, feeling that they enhanced his presence rather than diminishing it. The scars gave it character and had not overwhelmed to the point that it had become ratty. The jacket was in its prime and it knew it.
I'm going to hire professional help tomorrow. I can't handle this anymore. She fell over the coffee table and now there is blood in her catheter. This is much more than I ever signed up to do.
She had been told time and time again that the most important steps were the first and the last. It was something that she carried within her in everything she did, but then he showed up and disrupted everything. He told her that she had it wrong. The first step wasn't the most important. The last step wasn't the most important. It was the next step that was the most important.
It was a weird concept. Why would I really need to generate a random paragraph? Could I actually learn something from doing so? All these questions were running through her head as she pressed the generate button. To her surprise, she found what she least expected to see.
He walked down the steps from the train station in a bit of a hurry knowing the secrets in the briefcase must be secured as quickly as possible. Bounding down the steps, he heard something behind him and quickly turned in a panic. There was nobody there but a pair of old worn-out shoes were placed neatly on the steps he had just come down. Had he past them without seeing them? It didn't seem possible. He was about to turn and be on his way when a deep chill filled his body.
He was an expert but not in a discipline that anyone could fully appreciate. He knew how to hold the cone just right so that the soft server ice-cream fell into it at the precise angle to form a perfect cone each and every time. It had taken years to perfect and he could now do it without even putting any thought behind it. Nobody seemed to fully understand the beauty of this accomplishment except for the new worker who watched in amazement.
MaryLou wore the tiara with pride. There was something that made doing anything she didn't really want to do a bit easier when she wore it. She really didn't care what those staring through the window were thinking as she vacuumed her apartment.
Balloons are pretty and come in different colors, different shapes, different sizes, and they can even adjust sizes as needed. But don't make them too big or they might just pop, and then bye-bye balloon. It'll be gone and lost for the rest of mankind. They can serve a variety of purposes, from decorating to water balloon wars. You just have to use your head to think a little bit about what to do with them.
She looked at her student wondering if she could ever get through. "You need to learn to think for yourself," she wanted to tell him. "Your friends are holding you back and bringing you down." But she didn't because she knew his friends were all that he had and even if that meant a life of misery, he would never give them up.
What was beyond the bend in the stream was unknown. Both were curious, but only one was brave enough to want to explore. That was the problem. There was always one that let fear rule her life.
He sat across from her trying to imagine it was the first time. It wasn't. Had it been a hundred? It quite possibly could have been. Two hundred? Probably not. His mind wandered until he caught himself and again tried to imagine it was the first time.
You can decide what you want to do in life, but I suggest doing something that creates. Something that leaves a tangible thing once you're done. That way even after you're gone, you will still live on in the things you created.
He looked at the sand. Picking up a handful, he wondered how many grains were in his hand. Hundreds of thousands? "Not enough," the said under his breath. I need more.
She had come to the conclusion that you could tell a lot about a person by their ears. The way they stuck out and the size of the earlobes could give you wonderful insights into the person. Of course, she couldn't scientifically prove any of this, but that didn't matter to her. Before anything else, she would size up the ears of the person she was talking to.
Don't forget that gifts often come with costs that go beyond their purchase price. When you purchase a child the latest smartphone, you're also committing to a monthly phone bill. When you purchase the latest gaming system, you're likely not going to be satisfied with the games that come with it for long and want to purchase new titles to play. When you buy gifts it's important to remember that some come with additional costs down the road that can be much more expensive than the initial gift itself.
It was their first date and she had been looking forward to it the entire week. She had her eyes on him for months, and it had taken a convoluted scheme with several friends to make it happen, but he'd finally taken the hint and asked her out. After all the time and effort she'd invested into it, she never thought that it would be anything but wonderful. It goes without saying that things didn't work out quite as she expected.
At that moment he had a thought that he'd never imagine he'd consider. "I could just cheat," he thought, "and that would solve the problem." He tried to move on from the thought but it was persistent. It didn't want to go away and, if he was honest with himself, he didn't want it to.
Waiting and watching. It was all she had done for the past weeks. When you’re locked in a room with nothing but food and drink, that’s about all you can do anyway. She watched as birds flew past the window bolted shut. She couldn’t reach it if she wanted too, with that hole in the floor. She thought she could escape through it but three stories is a bit far down.
He was aware there were numerous wonders of this world including the unexplained creations of humankind that showed the wonder of our ingenuity. There are huge heads on Easter Island. There are the Egyptian pyramids. There’s Stonehenge. But he now stood in front of a newly discovered monument that simply didn't make any sense and he wondered how he was ever going to be able to explain it.
Then came the night of the first falling star. It was seen early in the morning, rushing over Winchester eastward, a line of flame high in the atmosphere. Hundreds must have seen it and taken it for an ordinary falling star. It seemed that it fell to earth about one hundred miles east of him.
Sitting in the sun, away from everyone who had done him harm in the past, he quietly listened to those who roamed by. He felt at peace in the moment, hoping it would last, but knowing the reprieve would soon come to an end. He closed his eyes, the sun beating down on face and he smiled. He smiled for the first time in as long as he could remember.
There was no time. He ran out of the door without half the stuff he needed for work, but it didn't matter. He was late and if he didn't make this meeting on time, someone's life may be in danger.
I recently discovered I could make fudge with just chocolate chips, sweetened condensed milk, vanilla extract, and a thick pot on slow heat. I tried it with dark chocolate chunks and I tried it with semi-sweet chocolate chips. It's better with both kinds. It comes out pretty bad with just the dark chocolate. The best add-ins are crushed almonds and marshmallows -- what you get from that is Rocky Road. It takes about twenty minutes from start to fridge, and then it takes about six months to work off the twenty pounds you gain from eating it. All things in moderation, friends. All things in moderation.
Was it enough? That was the question he kept asking himself. Was being satisfied enough? He looked around him at everyone yearning to just be satisfied in their daily life and he had reached that goal. He knew that he was satisfied and he also knew it wasn't going to be enough.
I've rented a car in Las Vegas and have reserved a hotel in Twentynine Palms which is just north of Joshua Tree. We'll drive from Las Vegas through Mojave National Preserve and possibly do a short hike on our way down. Then spend all day on Monday at Joshua Tree. We can decide the next morning if we want to do more in Joshua Tree or Mojave before we head back.
There are different types of secrets. She had held onto plenty of them during her life, but this one was different. She found herself holding onto the worst type. It was the type of secret that could gnaw away at your insides if you didn't tell someone about it, but it could end up getting you killed if you did.
Turning away from the ledge, he started slowly down the mountain, deciding that he would, that very night, satisfy his curiosity about the man-house. In the meantime, he would go down into the canyon and get a cool drink, after which he would visit some berry patches just over the ridge, and explore among the foothills a bit before his nap-time, which always came just after the sun had walked past the middle of the sky. At that period of the day the sun’s warm rays seemed to cast a sleepy spell over the silent mountainside, so all of the animals, with one accord, had decided it should be the hour for their mid-day sleep.
Sometimes it's simply better to ignore the haters. That's the lesson that Tom's dad had been trying to teach him, but Tom still couldn't let it go. He latched onto them and their hate and couldn't let it go, but he also realized that this wasn't healthy. That's when he came up with his devious plan.
The boy walked down the street in a carefree way, playing without notice of what was about him. He didn't hear the sound of the car as his ball careened into the road. He took a step toward it, and in doing so sealed his fate.
She wanted rainbow hair. That's what she told the hairdresser. It should be deep rainbow colors, too. She wasn't interested in pastel rainbow hair. She wanted it deep and vibrant so there was no doubt that she had done this on purpose.
There was something beautiful in his hate. It wasn't the hate itself as it was a disgusting display of racism and intolerance. It was what propelled the hate and the fact that although he had this hate, he didn't understand where it came from. It was at that moment that she realized that there was hope in changing him.
She looked at her little girl who was about to become a teen. She tried to think back to when the girl had been younger but failed to pinpoint the exact moment when she had become a little too big to pick up and carry. It hit her all at once. She was no longer a little girl and she stood there speechless with fear, sadness, and pride all running through her at the same time.
Dave found joy in the daily routine of life. He awoke at the same time, ate the same breakfast and drove the same commute. He worked at a job that never seemed to change and he got home at 6 pm sharp every night. It was who he had been for the last ten years and he had no idea that was all about to change.
"What is the best way to get what you want?" she asked. He looked down at the ground knowing that she wouldn't like his answer. He hesitated, knowing that the truth would only hurt. How was he going to tell her that the best way for him to get what he wanted was to leave her?
Her eyebrows were a shade darker than her hair. They were thick and almost horizontal, emphasizing the depth of her eyes. She was rather handsome than beautiful. Her face was captivating by reason of a certain frankness of expression and a contradictory subtle play of features. Her manner was engaging.
Things aren't going well at all with mom today. She is just a limp noodle and wants to sleep all the time. I sure hope that things get better soon.
The shoes had been there for as long as anyone could remember. In fact, it was difficult for anyone to come up with a date they had first appeared. It had seemed they'd always been there and yet they seemed so out of place. Why nobody had removed them was a question that had been asked time and again, but while they all thought it, nobody had ever found the energy to actually do it. So, the shoes remained on the steps, out of place in one sense, but perfectly normal in another.
"Begin today!" That's all the note said. There was no indication from where it came or who may have written it. Had it been meant for someone else? Meghan looked around the room, but nobody made eye contact back. For a brief moment, she thought it might be a message for her to follow her dreams, but ultimately decided it was easier to ignore it as she crumpled it up and threw it away.
The red glint of paint sparkled under the sun. He had dreamed of owning this car since he was ten, and that dream had become a reality less than a year ago. It was his baby and he spent hours caring for it, pampering it, and fondling over it. She knew this all too well, and that's exactly why she had taken a sludge hammer to it.
I recollect that my first exploit in squirrel-shooting was in a grove of tall walnut-trees that shades one side of the valley. I had wandered into it at noontime, when all nature is peculiarly quiet, and was startled by the roar of my own gun, as it broke the Sabbath stillness around and was prolonged and reverberated by the angry echoes.
Her mom had warned her. She had been warned time and again, but she had refused to believe her. She had done everything right and she knew she would be rewarded for doing so with the promotion. So when the promotion was given to her main rival, it not only stung, it threw her belief system into disarray. It was her first big lesson in life, but not the last.
The red ball sat proudly at the top of the toybox. It had been the last to be played with and anticipated it would be the next as well. The other toys grumbled beneath. At one time each had held the spot of the red ball, but over time they had sunk deeper and deeper into the toy box.
He ordered his regular breakfast. Two eggs sunnyside up, hash browns, and two strips of bacon. He continued to look at the menu wondering if this would be the day he added something new. This was also part of the routine. A few seconds of hesitation to see if something else would be added to the order before demuring and saying that would be all. It was the same exact meal that he had ordered every day for the past two years.
She never liked cleaning the sink. It was beyond her comprehension how it got so dirty so quickly. It seemed that she was forced to clean it every other day. Even when she was extra careful to keep things clean and orderly, it still ended up looking like a mess in a couple of days. What she didn't know was there was a tiny creature living in it that didn't like things neat.
It was difficult for him to admit he was wrong. He had been so certain that he was correct and the deeply held belief could never be shaken. Yet the proof that he had been incorrect stood right before his eyes. "See daddy, I told you that they are real!" his daughter excitedly proclaimed.
They argue. While the argument seems to be different the truth is it's always the same. Yes, the topic may be different or the circumstances, but when all said and done, it all came back to the same thing. They both knew it, but neither has the courage or strength to address the underlying issue. So they continue to argue.
The computer wouldn't start. She banged on the side and tried again. Nothing. She lifted it up and dropped it to the table. Still nothing. She banged her closed fist against the top. It was at this moment she saw the irony of trying to fix the machine with violence.
She nervously peered over the edge. She understood in her mind that the view was supposed to be beautiful, but all she felt was fear. There had always been something about heights that disturbed her, and now she could feel the full force of this unease. She reluctantly crept a little closer with the encouragement of her friends as the fear continued to build. She couldn't help but feel that something horrible was about to happen.
Cake or pie? I can tell a lot about you by which one you pick. It may seem silly, but cake people and pie people are really different. I know which one I hope you are, but that's not for me to decide. So, what is it? Cake or pie?
You know that tingly feeling you get on the back of your neck sometimes? I just got that feeling when talking with her. You know I don't believe in sixth senses, but there is something not right with her. I don't know how I know, but I just do.
The young man wanted a role model. He looked long and hard in his youth, but that role model never materialized. His only choice was to embrace all the people in his life he didn't want to be like.
A long black shadow slid across the pavement near their feet and the five Venusians, very much startled, looked overhead. They were barely in time to see the huge gray form of the carnivore before it vanished behind a sign atop a nearby building which bore the mystifying information "Pepsi-Cola."